{
  "record_type": "studio_state_snapshot",
  "contract_version": "V0",
  "generated_at": "2026-05-19T00:00:00Z",
  "source_delta_ids": [
    "fixture-report-001"
  ],
  "proven_surfaces": [
    "tests"
  ],
  "blocked_surfaces": [],
  "open_blockers": [],
  "open_risks": [],
  "decision_debt": [],
  "humangate_required_items": [
    {
      "summary": "HumanGate required by source delta",
      "status": "BLOCKED",
      "source_delta_id": "fixture-report-001",
      "source_task_id": "fixture-task-001"
    }
  ],
  "next_best_mission": null,
  "forbidden_next_missions": [
    "runtime_activation",
    "agent_activation",
    "decision_controller_activation",
    "search_backend_activation",
    "neural_agent_activation",
    "dataset_generation",
    "dataset_reset",
    "training",
    "benchmark",
    "model_checkpoint_creation",
    "model_promotion",
    "latest_json_creation",
    "lab_runs_creation",
    "lab_puzzles_creation",
    "public_claim",
    "release_automation"
  ],
  "status_by_surface": {
    "active_runtime_code": "UNKNOWN",
    "tests": "TESTED",
    "tools_scripts": "UNKNOWN",
    "artifacts_runtime_outputs": "UNKNOWN",
    "canonical_docs": "UNKNOWN",
    "roadmap_docs_only": "UNKNOWN",
    "inference": "UNKNOWN"
  },
  "claim_posture": "NO_CLAIM_ALLOWED",
  "no_global_ready_verdict": true
}
